{
  "$schema": "https://json-schema.org/draft/2020-12/schema",
  "$id": "https://urd.dev/schema/collection.schema.json",
  "title": "Urd collection (content/samlinger/<id>.json)",
  "description": "A collection of entries of the same kind (news, notices, publications) rendered by the collection block. The contract is described in docs/SCHEMA.md and ADR-0007.",
  "type": "object",
  "required": ["schemaVersion", "id", "name", "kind", "entries"],
  "additionalProperties": false,
  "properties": {
    "schemaVersion": { "type": "integer", "minimum": 1 },
    "id": { "type": "string", "pattern": "^[a-z0-9][a-z0-9-]*$" },
    "name": { "type": "string", "minLength": 1 },
    "kind": { "enum": ["news", "notices", "publications", "products", "custom"] },
    "entries": {
      "type": "array",
      "items": {
        "type": "object",
        "required": ["id", "title"],
        "additionalProperties": false,
        "properties": {
          "id": { "type": "string", "pattern": "^[a-z0-9][a-z0-9-]*$" },
          "title": { "type": "string", "minLength": 1, "description": "Rich text (safe HTML subset); plain text is derived with textContent where data is needed" },
          "date": { "type": "string", "pattern": "^\\d{4}-\\d{2}-\\d{2}$", "description": "ISO date (YYYY-MM-DD); used for sorting, the date badge and year grouping" },
          "text": { "type": "string", "description": "Rich text (safe HTML subset, same protection as text blocks); title is always plain text" },
          "image": { "type": "string", "description": "Path in media/ (data URL in draft); materialized at publish" },
          "page": { "type": "string", "pattern": "^[a-z0-9][a-z0-9-]*$", "description": "A page id from site.pages the title links to (additive from 0.7.27.3); wins over href" },
          "target": { "type": "string", "pattern": "^[a-z0-9][a-z0-9-]{0,80}$", "description": "The id of a section or block on that page (or on the page the block stands on) the title lands on (additive from 0.7.27.3)" },
          "href": { "type": "string", "description": "Optional link (internal path or external URL); makes the title clickable. Through the shared safe-URL gate" },
          "newTab": { "type": "boolean", "default": false, "description": "Open the title's link in a new tab (additive from 0.7.27.3)" },
          "download": { "type": "boolean", "default": false, "description": "Save the file the title links to rather than open it (additive from 0.7.27.9); counts only for a path on the site" },
          "rel": { "type": "array", "uniqueItems": true, "items": { "enum": ["nofollow", "sponsored"] }, "description": "Rel words for a link that leaves the site (additive from 0.7.27.3)" },
          "imageAlt": { "type": "string", "description": "Alt text for the entry image (additive from v0.6)" },
          "price": { "type": "number", "minimum": 0, "description": "Product price (kind products, additive from v0.7); the currency word is set on the product block" },
          "memberPrice": { "type": "number", "minimum": 0, "description": "Optional member price (kind products); shown next to the regular price" },
          "badge": { "type": "string", "description": "Short label on the product card (kind products), e.g. New or Sale" },
          "sizes": {
            "type": "array",
            "description": "Size options (kind products); shown as choice chips on the card",
            "items": { "type": "string", "minLength": 1 }
          },
          "colors": {
            "type": "array",
            "description": "Color options (kind products); an option with its own image swaps the card's image",
            "items": {
              "type": "object",
              "required": ["name"],
              "additionalProperties": false,
              "properties": {
                "name": { "type": "string", "minLength": 1 },
                "image": { "type": "string", "description": "Path in media/ (data URL in draft); materialized at publish" }
              }
            }
          },
          "imageStyle": {
            "type": "object",
            "description": "Non-destructive image style (additive from v0.6): focus point, filters, fit, shape, zoom, rounding",
            "additionalProperties": false,
            "properties": {
              "fit": { "enum": ["cover", "contain"] },
              "radius": { "enum": ["sm", "md"] },
              "shape": { "enum": ["wide", "square", "portrait", "circle"], "description": "The frame's shape (aspect ratio); circle is 1:1 with full rounding" },
              "zoom": { "type": "number", "minimum": 1, "maximum": 3, "description": "Crops in toward the focus point; the frame clips the rest" },
              "x": { "type": "number", "minimum": 0, "maximum": 1 },
              "y": { "type": "number", "minimum": 0, "maximum": 1 },
              "brightness": { "type": "number", "minimum": 0, "maximum": 2 },
              "contrast": { "type": "number", "minimum": 0, "maximum": 2 },
              "saturate": { "type": "number", "minimum": 0, "maximum": 2 }
            }
          }
        }
      }
    }
  }
}
